,index,GEOID,Hospital,State,ORIG_LAT,ORIG_LONG,ThrombCenter,DEST_LAT,DEST_LONG,AERIAL_3,DISTANCE_ROAD,DISTANCE_TIME
0,0,0,Penn State Children's Hospital,42,40.264298,-76.673751,Geisinger Medical Center,40.968461,-76.604811,78.41214415,114768.39200000004,127
1,18,18,Lehigh Valley Reilly Children's Hopital,42,40.567081,-75.523948,Abington Hospital,40.118897,-75.119863,60.46061604,66930.313,80
2,26,26,Janet Weis Children's Hospital at Geisinger,42,40.969691999999995,-76.60424,Penn State Milton S. Hershey Medical Center,40.26441,-76.67401,78.54131422,114801.4680000001,118
3,29,29,Children's Hospital of Philadelphia,42,39.9481,-75.19318,Cooper University Hospital,39.941520000000004,-75.1168,6.568389332000001,8806.307000000003,35
4,129,129,St. Christopher's Hospital for Children,42,40.006840000000004,-75.13117,Thomas Jefferson University Hospitals,39.94982,-75.15867,6.752915657000001,7407.337000000002,52
5,132,132,UPMC Children's Hospital of Pittsburgh,42,40.46656,-79.95374,Allegheny General Hospital,40.45704,-80.00362,4.360690573,5603.426000000002,31
