,index,GEOID,USPS,Hospital,State,ORIG_LAT,ORIG_LONG,THROMB,DEST_LAT,DEST_LONG,AERIAL_2,DISTANCE_ROAD,DISTANCE_TIME
0,23,23,MN,Mayo Eugenio Litta Children's Hospital,27,44.021342,-92.48219499999999,United Hospital,44.942890000000006,-93.10753000000001,113.84723429999998,123087.57099999997,129
1,33,33,MN,Children's Hospitals and Clinics of Minnesota - St. Paul,27,44.942184000000005,-93.10791,Regions Hospital,44.955940000000005,-93.09423000000001,1.871486734,2913.384,25
2,78,78,MN,Children's Hospitals and Clinics of Minnesota,27,44.956806,-93.26255,Hennepin Healthcare System,44.971804999999996,-93.262563,1.6668553830000001,1574.2879999999998,13
3,79,79,MN,University of Minnesota Masonic Children's Hospital,27,44.965992,-93.2373,Hennepin Healthcare System,44.971804999999996,-93.262563,2.095068483,2645.497,14
4,98,98,MN,Hennepin County Medical Center,27,44.972786,-93.26274000000001,Abbott Northwestern Hospital,44.95397,-93.26171,2.0926205380000003,2469.3450000000003,19
5,201,201,MN,St. Mary's Children's Hospital,27,46.7929,-92.09634399999999,Regions Hospital,44.955940000000005,-93.09423000000001,218.37551549999998,238567.96000000002,122
