,index,GEOID,Hospital,State,ORIG_LAT,ORIG_LONG,ThrombCenter,DEST_LAT,DEST_LONG,AERIAL_2,DISTANCE_ROAD,DISTANCE_TIME
0,5,5,Children's Hospitl of Richmond at VCU,51,37.540268,-77.432846,Bon Secours St. Mary's Hospital of Richmond,37.58314,-77.51298,8.530438427,9253.727000000003,49
1,53,53,Bon Secours St. Mary's Hospital Children's Services,51,37.585026,-77.512596,Virginia Commonwealth University Health System Authority,37.540289,-77.430789,8.76896083,9046.586000000001,38
2,91,91,Inova Children's Hospital,51,38.858765000000005,-77.22603000000001,University of Maryland Medical Center,39.28816,-76.6247,70.5709215,77335.80200000001,105
3,112,112,Children's Hospital of the King's Daughters,51,36.861340000000006,-76.30162,Riverside Regional Medical Center,37.065,-76.48348,27.80509146,38045.096,79
4,149,149,Carilion Clinic Children's Hospital,51,37.25206,-79.94169000000001,Wake Forest Baptist Medical Center,36.08932,-80.26876,132.3018726,100302.42400000001,117
