,index,GEOID,Hospital,State,ORIG_LAT,ORIG_LONG,ThrombCenter,DEST_LAT,DEST_LONG,AERIAL_1,DISTANCE_ROAD,DISTANCE_TIME
0,31,31,Floating Hospital for Children at Tufts Medical Center,25,42.349948,-71.063829,Tufts Medical Center,42.349305,-71.06378000000001,0.071538509,631.1129999999999,10
1,34,34,Boston Children's Hospital,25,42.337776,-71.10519000000001,Brigham & Women's Hospital,42.33611,-71.10748000000001,0.264317236,459.14799999999997,4
2,92,92,Baystate Children's Hospital,25,42.118990000000004,-72.60416,Hartford Hospital,41.75437,-72.67905,40.97255905,43816.143,66
3,148,148,Umass Memorial Children's Medical Center,25,42.279568,-71.75844000000001,UMass Memorial Medical Center â€“ University Campus,42.27625,-71.76208000000001,0.475386642,624.3879999999999,7
4,159,159,MassGeneral Hospial for Children,25,42.36244,-71.06983000000001,Mass General Hospital,42.36278,-71.06867,0.102751908,0,0
