,index,GEOID,Hospital,State,ORIG_LAT,ORIG_LONG,ThrombCenter,DEST_LAT,DEST_LONG,AERIAL_2,DISTANCE_ROAD,DISTANCE_TIME
0,6,6,Children's Hospital of Wisconsin,55,43.043343,-88.026276,Aurora St. Luke's Medical Center,42.989683,-87.951206,8.543215808,11832.743999999999,59
1,102,102,Marshfield Children's Hospital,55,44.676277,-90.18004599999999,Aurora BayCare Medical Center,44.4753,-87.93879,179.4046076,198624.95400000003,163
2,124,124,HSHS St Vincent Children's Hospital,55,44.501484000000005,-88.012856,ThedaCare,44.187789,-88.453643,49.50201308,55214.86100000002,89
3,154,154,Gundersen Lutheran Medical Center,55,43.795196999999995,-91.24693,University of Wisconsin Hospitals and Clinics Authority,43.076545,-89.43396,167.0868396,195973.94499999957,155
4,156,156,American Family Children's Hospital,55,43.078274,-89.43336500000001,Javon Bea Hospital-Riverside Campus,42.316614,-88.960424,93.06241599,115663.684,103
